{
  "api_version": "xdebug.v1",
  "ok": true,
  "action": "trace.active_driver_chain",
  "summary": {
    "signal": "top.u.out",
    "start_time": "26ns",
    "hop_count": 2,
    "termination": "primary_input",
    "truncated": false
  },
  "data": {
    "hops": [
      {
        "index": 0,
        "file": "rtl/top.sv",
        "line": 88,
        "source_context": [
          {"line": 85, "text": "logic mid;", "active": false},
          {"line": 86, "text": "", "active": false},
          {"line": 87, "text": "always_comb begin", "active": false},
          {"line": 88, "text": "  out = mid;", "active": true},
          {"line": 89, "text": "end", "active": false}
        ],
        "signal_path": [
          "top.u.mid",
          "top.u.out"
        ]
      },
      {
        "index": 1,
        "file": "rtl/top.sv",
        "line": 73,
        "source_context": [
          {"line": 70, "text": "assign src = in;", "active": false},
          {"line": 71, "text": "", "active": false},
          {"line": 72, "text": "always_ff @(posedge clk) begin", "active": false},
          {"line": 73, "text": "  mid <= src;", "active": true},
          {"line": 74, "text": "end", "active": false}
        ],
        "signal_path": [
          "top.u.src",
          "top.u.mid"
        ]
      }
    ]
  },
  "error": null
}
